{
  "canonicalizationVersion": 1,
  "viewVersion": 1,
  "mission": "M-2026-0001",
  "drones": [
    {
      "droneId": "drone-comms-03",
      "latitudeMicrodegrees": 47120001,
      "longitudeMicrodegrees": -122650001,
      "batteryPercent": 64,
      "altitudeMetres": 380,
      "headingDegrees": 95,
      "groundSpeedCentimetresPerSecond": 610
    },
    {
      "droneId": "drone-vision-01",
      "latitudeMicrodegrees": 47123456,
      "longitudeMicrodegrees": -122654321,
      "batteryPercent": 87,
      "altitudeMetres": 412,
      "headingDegrees": 270,
      "groundSpeedCentimetresPerSecond": 850
    }
  ]
}
